{
    "object_id": {
        "alias" : "My_run_NM305004", 
        "center_name" : "EBI-TEST"
    },
    "object_title": "",
    "object_description": "",
    "run_center": "EBI-TEST",
    "run_date": "2022-02-13",
    "sample_number": 3,
    "run_relationships": [
        {
            "r_type": {
                "r_type_id": "referenced_by"
            },
            "r_source": {
                "object_id": {
                    "ega_accession": "EGAX00002094401"
                },
                "object_type": "experiment"
            },
            "r_target": {
                "object_id": {
                    "alias": "My_run_NM305004",
                    "center_name": "EBI-TEST"
                },
                "object_type": "run"
            }
        }
    ],
    "run_files": [
        {
            "filename": "myfile1_NM305004_50000reads.cram.gpg",
            "filetype": {
                "filetype_id": "CRAM"
            },
            "checksum_method": {
                "checksum_method_id": "MD5"
            },
            "unencrypted_checksum": "9a4249e4b0538b9789c5d7f25d6342f0",
            "encrypted_checksum": "c6779ec2960296ed9a04f08d67fa4415"
        },
        {
            "filename": "myfile2_NM305004_50000reads.cram.gpg",
            "filetype": {
                "filetype_id": "CRAM"
            },
            "checksum_method": {
                "checksum_method_id": "MD5"
            },
            "unencrypted_checksum": "e8c111e482c9ca49967497fecd988fe9",
            "encrypted_checksum": "d92463599ed4548cfa4fff55c1b48d7e"
        }
    ],
    "run_attributes": [
        {
            "tag": "Read count",
            "value": "50000"
        }
    ],
    "schema_descriptor": {
        "object_type": "run",
        "described_by_schema_uri": "https://github.com/EbiEga/ega-metadata-schema/tree/main/schemas/EGA.run.json",
        "object_schema_version": "0.0.0",
        "common_schema_version": "0.0.0"
    }
}